review,giai_tri,luu_tru,nha_hang,an_uong,van_chuyen,mua_sam
"Sân mới được nâng cấp, sạch và mới, đặc biệt là mặt sân. Phần chỗ ngồi đa phần không có ghế, ngồi bệ xi măng.",5,0,0,0,0,0
"Phòng cách âm không được tốt cho lắm, tiếng xả nước nhà vệ sinh phòng bên cạnh nghe rất rõ. Không biết sơ sót hay là khách sạn như vậy rồi nhưng tủ đồ phòng mình ở chỉ có duy nhất một cái móc treo đồ, không đủ treo cho những bộ khác",0,2,0,0,0,0
"Quán rộng, thoáng mát, hải sản tươi sống, giá hợp lý. Nói chung là hết ý với Quy Nhơn.",0,0,0,5,0,0
nhân viên thân thiện. có ăn sáng kèm giá phòng. vị trí khá trung tâm,0,4,0,0,0,0
Chỗ nghỉ ok nhưng ace không nên ăn ở quán ngay đối diện đó. Hơi đắt và đồ ăn cũng không ngon,0,4,0,2,0,0
"Nhân viên dễ thương, nhiệt tình",0,5,5,0,0,0
"Cân nhắc khi đến đây. Mang tiếng bar mà đồ uống như quán cafe bình thường, nhạc chán không có nhạc sống. Được mỗi chỗ ngồi view sát biển.",3,0,0,2,0,0
Hồ bơi hơi bẩn và để không đó hơi lãng phí.,1,0,0,0,0,0
"Thật sự chưa thấy chổ nào cho thuê xe máy nhiệt tình và tận tâm như chổ này. Hôm trước mình có ghé 27a hoàng hoa thám thuê xe, hôm nay trả xe mãi lo ham chơi quên gọi hỏi ý anh chị chủ trước . Gần 11h mình mới gọi anh chị ra bến xe Kim Liên để trả xe vậy mà anh chị chủ vẫn rất vui vẻ và cởi mở hỏi han làm mình cảm thấy vô cùng có lỗi. Cảm ơn anh chị đã giúp em có xe tốt vi vu mấy ngày ở quy nhơn. Các bạn đến quy nhơn du lịch cần thuê xe máy cứ liên hệ chổ này là yên tâm nhất nhé",0,0,0,0,4,0
"Đồ hợp gu với giới trẻ, giá ổn không quá cao, phù hợp với sinh viên, quần áo cũng khá đẹp, nên ghé qua",0,0,0,0,0,4
"Các bạn muốn qua đây thì search google maps là Bến Tàu Hàm Tử Đi Cù Lau Xanh. Như vậy sẽ dễ kiếm hơn, trên địa chỉ foody sai rồi. Đến đó bạn hỏi ngta tàu qua Hải Minh trong vì có Hải Minh ngoài nữa, là nơi tượng đài Trần Hưng Đạo . Rồi nói ngta đưa đến Nhà Hàng Bè Nổi Biển Đông là ngta biết à. Rồi vô vấn đề chính, đồ ăn tươi ngon, giá hợp lý, không mắc nếu so với giá trên SG. Có câu cá free mà câu hoài không được con nào buồn dễ sợ .",0,0,0,5,0,0
"Nhân Viên Nhiệt Tình, Chuyên Nghiệp, Sạch sẽ, gần bãi biển, view đẹp.",0,4,0,0,0,0
"Lần đầu có dịp đi Quy Nhơn chơi, được sắp xếp vào ăn trưa ở nhà hàng lớn vầy cũng khoái. Nhà hàng nằm sát biển có view đẹp, lại gần trung tâm thành phố Quy Nhơn. Cơm trưa được bày ra từng bàn riêng biệt, kèm theo menu các món. Có đủ các món mặn như thịt, cá, các món rau và canh. Nhân viên phục vụ nhiệt tình, nhanh nhẹn, chuyên nghiệp.",0,0,5,5,0,0
Cả hai chúng tôi đã có một thời gian tuyệt vời và thích nấu ăn và ăn! Các món ăn khác nhau Cảm ơn bạn đã có kinh nghiệm tốt,0,0,0,3,0,0
"Nhân viên rất thân thiện, nói chuyện dễ thương, vị trí tiện lợi đi lại",0,5,0,0,0,0
"Mặc dù người lớn hay dặn dò đừng ăn gà rán quá nhiều, đừng ăn đồ chiên dầu mỡ quá nhiều, nhưng liệu có mấy ai cưỡng lại được sức hấp dẫn của gà rán hay không ? Ở Quy Nhơn, ngày nào chán quá không biết ăn gì thì hẳn là sẽ đi ăn gà rán, mẹ không nấu cơm, cũng sẽ dắt em út đi ăn gà rán. Ăn gà rán ở đâu ? Quy Nhơn có 4 thương hiệu gà rán luôn, nhưng em mình hay đòi ăn Joll nhắn tin ee nhất, tại nước chấm ở đây không cay, ở đây còn có mì Ý nữa. Joll nhắn tin ee có 2 tiệm, 1 là ở tầng 1 Kim Cúc Plaza và 1 ở Nguyễn Huệ, gần ngay Nice Cafe ấy. Cá nhân mình thấy gà rán ở đây ngon mà, nước chấm ngọt ngọt chua và ít cay nên dễ ăn",0,0,0,5,0,0
Đi mùa vắng khách sau dịch Covid nên khu tập gym và bar không hoạt động.,0,2,0,0,0,0
"Nhà xe rất lịch sự, khách cũng lịch sự, có cả khách tây, xe sạch sẽ, thơm tho. Lần sau sẽ trở lại. Giải trí trên xe tuyệt vời, tối có phim chiếu rạp coi luôn.",0,0,0,0,5,0
Chắc có lẽ không có dịch vụ nào vừa sửa chữa xe máy kết hợp với lại cho thuê xe máy như dịch vụ Xuân Tính tại Quy Nhơn vừa gọi điện chưa tới 5 phút là có mặt .Điều đầu tiên là nhìn thấy xe là thấy thích rồi xe thì mới lại được rửa rất sạch sẽ nhiêu đó có thể cho 5star rồi .Tiếp đến vợ chồng anh chị chủ rất nhiệt tinh tư vấn cho mình những địa điểm du lịch cũng như hàng quán ăn vặt tại Quy Nhơn tiếc là chỉ có 5star chứ còn thì mình cũng sẽ đánh giá cho dịch vụ Xuân Tính . Trên cả tuyệt vời Very tốt,0,0,0,0,5,0
"Nhân viên bảo vệ ảo tưởng sức mạnh nghĩ khách hàng thích mình rồi lại nháy mắt đưa tình các kiểu Sao 2 em chạy vậy,bộ say anh hả Nhân viên thật là ải chỉa đừng để tui gặp lại nữa tui mà gặp nữa tui ỉa pẹc pẹc banh cái siêu thị pủm pủm ỉa tám đống negative negative negative negative negative negative negative",0,0,0,0,0,1
"Đây là nơi có dịch vụ tốt, các món ăn được chế biến từ hải sản rất ngon, và giá cả hợp lý. Chắc chắn tôi sẽ quay lại quán lần nữa nếu có dịp đến với Quy NHơn",0,0,0,5,0,0
"Combo bãi tắm hoàng hậu, bãi trứng, mộ Hàn Mặc Tử, nói chung đi cho biết 1 lần thôi, chỉ chụp hình kỷ niệm, không có gì thêm, bãi trứng cũng rất nhỏ, khi đông người thì chen nhau chụp, nên đi ngày trong tuần vắng người hơn.",3,0,0,0,0,0
Những người phụ nữ ghé thăm bàn của bạn để gọi món không ưu tiên cho câu hỏi của bạn nếu bạn có một số về Các món ăn.,0,0,0,0,0,0
Rượu rất là ngon và đậm đà. Nhất định sẽ ủng hộ lâu dài,0,0,0,5,0,0
Rất nhiều đặc sản địa phương Giá hơi cao nhưng được,0,0,0,0,0,5
"Tiếng sập cửa khá to, Khách sạn nên có khuyến nghị khách nhẹ tay khi sập cửa. Phòng gym quá nghèo nàn.",0,1,0,0,0,0
"Nhân viên nhiệt tình, thân thiện. Phòng sạch sẽ, có bồn tắm, view biển, tiện nghi đầy đủ",0,5,0,0,0,0
Rất ấn tượng bởi cả dịch vụ được cung cấp và phản hồi nhanh chóng qua email cho cả thông tin liên lạc báo giá và xác nhận.,5,0,0,0,0,0
"Thức ăn là ẩm thực Việt Nam, nguyên liệu đắt tiền thì rất ít, nguyên liệu rẻ tiền thì nhiều, hoàn toàn khác xa với ẩm thực Việt Nam tinh tế. Có mùi của loại địa điểm được các khách sạn nhất định giới thiệu cho các mục đích đi lại.",0,0,0,2,0,0
Chúng tôi đến đây để ăn vì được đánh giá tốt và khách sạn của chúng tôi cũng giới thiệu nó. Gọi một con cá mập nướng và vợ tôi một món cơm chiên.,0,0,3,0,0,0
"Thủ tục thuê đơn giản, nhanh chóng. Xe rửa sạch sẽ trước khi giao. Vô cùng chu đáo, sẽ tiếp tục thuê vào lần sau",0,0,0,0,5,0
"Dịch vụ thuê xe rất tốt thủ tục thuê xe rất nhanh gọn anh chu rất dễ thương, lần sau vào Quy Nhơn tôi sẽ tiếp tục ủng họ dịch vụ này rất uy tín",0,0,0,0,5,0
"giá phòng ok, phòng sạch sẽ, view biển đẹp",0,4,0,0,0,0
"Hiện tại đã tu sửa xong, tuy nhiên loại hình nghệ thuật này phổ biến ở vùng nông thôn Bình Định hơn là thành phố, đáng buồn là người dân thành phố chưa có sự quan tâm đúng mức đến loại hình nghệ thuật đặc sắc này",4,0,0,0,0,0
"Lần đầu tiên được lái môtô nước là ở đây nè, trong một ngày hè nắng chang chang, cảm giác phê lòi luôn. Làng chài khá vắng và yên bình lúc này khách du lịch chưa biết đến nhiều . Hải sản thì tươi ngon cực kỳ, ai đến đây nhất định phải thử món bánh xèo mực nha, mực tươi giòn ngọt hết ý tiếc là lúc đó ham ăn quá chưa chụp được ảnh",5,0,0,5,0,0
"Chuyên nghiệp, lịch sự, nói chuyện rất dễ thương Mình thuê 3 xe 3 ngày còn được disconut 10 , xe đời mới, giá lại rẻ không như xe của khách sạn vừa cũ mà giá lại cao. Dịch vụ cho thuê xe máy ở đây rất nhiệt tình, giao xe tận nơi và lấy xe tận nơi hoàn toàn miễn phí, một ngày tính theo 24 tiếng bắt đầu từ lúc nhận xe nhưng khi mình trả xe lỡ đi xa quá về không kịp trễ hẳn 2 tiếng. Bạn chủ vẫn rất vui vẻ và không tính theo phí phát sinh. Kinh doanh rất sởi lởi và thiệt tình, cho bạn đánh giá 5star nhé",0,0,0,0,5,0
"Mua 2 chai nước, nhưng không được đem vào sân phải để ngoài,dân mình hiền mà có gấu như mấy sân ngoài bắc đâu",4,0,0,0,0,0
Tuy không sang trọng như xe cao cấp nhưng đầy đủ tiện nghi. Phòng rộng thoải mái nằm. Các nhân viên đều rất chu đáo với khách hàng. Dù mình xuống bến không có trong điểm đặt nhưng các chú vẫn hỗ trợ. Khi khách xuống xe còn chào khách rất lịch sự.,0,0,0,0,4,0
"Tiện nghi, sạch sẽ, nhân viên thân thiện và ân cần. Rất thoải mái khi nghỉ dưỡng ở đây, view biển cực đẹp, giá rất phải chăng",0,4,0,0,0,0
"Một bữa ăn thanh mát, không dầu mỡ chiên xào giữa trưa nắng, cực thích luôn. Các bạn nhân viên sẽ hướng dẫn khách từng bước một để chọn một tô cơm đầy màu sắc cho riêng mình.",5,0,0,5,0,0
Nhân viên làm thủ tục nhận phòng muốn thu thêm tiền trẻ em 12 tuổi. Trong khi trên b ok ng đã ghi rõ số lượng người lưu trú và tuổi các cháu.,0,1,0,0,0,0
"Trái cây và rau tươi được lựa chọn hạn chế. Đó là một siêu thị lớn nhưng chủ yếu chứa đầy những thứ mà tôi là một người nước ngoài sẽ không bao giờ mua. Ví dụ như dầu ăn và mì gói là rất lớn. Nó nằm trên tầng cao nhất, không thuận tiện. Bạn cần đi hai thang cuốn lớn để đến nơi. Cả ngày họ đang nướng bánh mì tươi, thật tuyệt!",0,0,0,0,0,4
"Dịch vụ ăn uống rất tệ, giá cả không hợp lý, quá cao so với thị trường",0,0,0,1,0,0
Phòng rộng rãi thoáng nhân viên dễ thương,0,5,0,0,0,0
Tránh nơi này! Bánh tráng cuốn khi sờ vào rất cứng và có mùi vị rất lạ. Họ tưới cây trên tường phía trên bạn bằng hệ thống phun nước. Nước rơi xuống thức ăn và đồ uống của bạn.,0,0,0,2,0,0
"Team mình vừa thuê bên bạn 3 chiếc xe, xe các bạn giao đến còn khá mới, xe tốt và mình thích nhất là cách tư vấn của a chủ, a ấy rất nhiệt tình vui vẻ hướng dẫn cho team mình rất nhiều điểm chơi và ăn uống khá rẻ tại Đà Nẵng. Qua đây team mình cảm ơn a ấy rất nhiều.",0,0,0,0,5,0
"View đẹp, nhân viên tuy không tiếp xúc nhưng tư vân rất tận tình qua zalo, đt. Hoàng hôn nhìn từ ks rất đẹp",0,5,0,0,0,0
"Chợ nhỏ, thương nhân vui tính, hải sản tươi ngon nhưng không đầy đủ các loại hải sản",0,0,0,0,0,4
"Mặc dù ban đầu có nghĩa là cho khách đi làm như khách du lịch, đây là một cách tuyệt vời tuyệt vời để có được trên mặt nước với giá rẻ.",4,0,0,0,4,0
"Chị chủ cửa hàng nhiệt tình, thân thiện, gói các kiểu quà tặng theo nhiều phong cách tuyệt vời",0,0,0,0,0,5
"Tôi nghe nhiều du khách nói gì đó về bánh pancake tôm giòn bahn xeo. Đi lên cửa hàng ngay khi chúng tôi đến Quy Hưng. Họ đã mang nhiều thứ lên bàn và chúng tôi không biết làm thế nào để đối phó với quá nhiều thứ. May mắn thay, các nhân viên đã chú ý và chỉ cho chúng tôi cách cuộn nó trong bánh tráng sau đó thưởng thức với nước mắm. Thú vị ngon miệng! Đó là một chút dầu nên chúng ta không thể ăn nhiều.",0,0,5,5,0,0
"E chọn gần 10 cái khách sạn rồi . chấm điểm e này cao nhất . đến lúc vào công nhận là quá ok luôn ạ. lễ Tân thân thiện , phòng veiw đẹp , sạch sẽ , yên tĩnh . mê chữ ê kéo dài luôn ik",0,5,0,0,0,0
"Cửa hàng cần quả n lý lại nhân viên và cách phục vụ. Khi đưa lại thẻ cho khách phải đưa luôn bill và số bàn đầy đủ, không đưa 2 3 lần.",0,0,0,2,0,0